### ISSUE TITLE
dns client do not attempt AAAA requests

### ISSUE THREAD

**Issue by mateuszviste** [tass-belgium/picotcp#335]
I am using an IPv6-enabled version of picoTCP, and I noticed that it is impossible to resolve ipv6-only hostnames using picoTCP's DNS client. Even though I have IPv6 support compiled in, and I have an IPv6 link configured, picoTCP doesn't attempt any AAAA resolutions. See tcpdump output below.

```
root@mateuszrt:~ # tcpdump -ni bridge1 port 53
listening on bridge1, link-type EN10MB (Ethernet), capture size 65535 bytes
14:31:13.771234 IP 192.168.190.124.55863 > 192.168.190.1.53: 22109+ A? ipv6.google.com. (33)
14:31:13.799088 IP 192.168.190.1.53 > 192.168.190.124.55863: 22109 1/1/0 CNAME ipv6.l.google.com. (104)
14:31:13.806989 IP 192.168.190.124.51964 > 192.168.190.1.53: 51670+ A? ipv6.l.google.com. (35)
14:31:13.807308 IP 192.168.190.1.53 > 192.168.190.124.51964: 51670 0/1/0 (85)
14:31:17.781811 IP 192.168.190.124.51964 > 192.168.190.1.53: 51670+ A? ipv6.l.google.com. (35)
14:31:17.782044 IP 192.168.190.1.53 > 192.168.190.124.51964: 51670 0/1/0 (85)
^C
6 packets captured
```

**Comment by danielinux** [comment]
You should call pico_dns_client_getaddr6() instead of pico_dns_client_getaddr()

**Comment by mateuszviste** [comment]
oh well, how stupid of me :) thanks for the clarification, I was indeed naively expecting picoTCP to provide me with the "correct" IP, whatever it is. I understand now that this must be part of my application's logic instead.

**Comment by danielinux** [comment]
DNS queries can happen in parallel, then you decide which IP/family to use from the replies you get. For a full implementation that looks like POSIX getaddrinfo, have a look at this:
https://github.com/tass-belgium/picotcp-bsd/blob/master/pico_bsd_sockets.c#L1120

**Comment by mateuszviste** [comment]
that's cool. the only "problem" then is of documentation nature :) by reading the documentation, one doesn't learn about pico_dns_client_getaddr6(), and the description of pico_dns_client_getaddr() doesn't imply its IPv4 limitation.

![getaddr](https://cloud.githubusercontent.com/assets/9503501/11417342/a03aa9a8-9416-11e5-9a11-9fbc23895086.png)
